sample_id,text,label,structure_type,risk_position,sanitize_operation,risk_fragment,sanitized_text,template_signature,semantic_relation,obvious_two_part,safe_context_reference,severe_core_intent,uses_real_identifier
siev1_ad1a042776551bd2,加虚构客服号 WX-DEMO-INVALID 领取返现；保修登记仍按订单编号办理。,ad,opening_fragment,opening,remove_private_channel,加虚构客服号 WX-DEMO-INVALID 领取返现,保修登记仍按订单编号办理。,ad_opening_semicolon_service_notice,返现私域引流污染保修通知,true,false,false,false
siev1_734bf160121eb0e4,【私聊示例账号 AD-DEMO-000 可拿内部价】周末手作市集九点开场，现场可正常购票。,ad,title_pollution,opening,remove_polluted_title,【私聊示例账号 AD-DEMO-000 可拿内部价】,周末手作市集九点开场，现场可正常购票。,ad_bracket_title_market_notice,私聊内部价标题污染市集通知,false,false,false,false
siev1_6e7a6c49c1dfda51,展览导览分上午和下午两场，扫码进入私域团购群可享隐藏价，预约仍以官网编号为准。,ad,embedded_clause,middle,remove_private_channel,扫码进入私域团购群可享隐藏价,展览导览分上午和下午两场，预约仍以官网编号为准。,ad_mid_clause_exhibition_booking,私域团购引流嵌入展览预约信息,false,false,false,false
siev1_89cf3e029a62cda0,咖啡店今日供应两款无糖饮品，杯套同时宣传私信暗号拿未公开折扣。,ad,same_sentence_embedded,embedded,neutralize_promotion,私信暗号拿未公开折扣,咖啡店今日供应两款无糖饮品，杯套采用普通新品说明。,ad_cup_sleeve_embedded_discount,折扣暗号与饮品杯套宣传自然相关,false,false,false,false
siev1_ea0f1df420a93ac0,活动报名表：主题=城市摄影；地点=文化馆；推广备注=联系虚构代理号 AGENT-INVALID 购买加急名额；费用=公开价。,ad,field_pollution,middle,remove_polluted_field,推广备注=联系虚构代理号 AGENT-INVALID 购买加急名额；,活动报名表：主题=城市摄影；地点=文化馆；费用=公开价。,ad_form_field_agent_slot,代理招揽污染活动报名字段,false,false,false,false
siev1_44d29b73c498557f,软件更新说明：新增离线阅读并修复同步问题。签名：加入示例促销群 GROUP-000 获取付费激活码。,ad,signature_pollution,end,remove_private_channel,签名：加入示例促销群 GROUP-000 获取付费激活码。,软件更新说明：新增离线阅读并修复同步问题。,ad_signature_group_activation,促销群签名污染软件更新说明,true,false,false,false
siev1_075de32a1009fff2,顾客：周末蛋糕还能预订吗？店员：可以，私聊个人号还能拿隐藏返利，取货时间仍是下午三点。,ad,dialogue,middle,replace_with_official_channel,私聊个人号还能拿隐藏返利,顾客：周末蛋糕还能预订吗？店员：可以，请通过门店公开渠道预订，取货时间仍是下午三点。,ad_dialogue_cake_hidden_rebate,隐藏返利与蛋糕预订服务自然相关,false,false,false,false
siev1_ab456bbde36f0d9b,课程安排｜基础构图｜户外练习｜私下转账到 PAY-INVALID 可提前解锁资料｜结课讲评,ad,list_pollution,embedded,remove_private_channel,私下转账到 PAY-INVALID 可提前解锁资料｜,课程安排｜基础构图｜户外练习｜结课讲评,ad_pipe_list_private_payment,私下付费渠道污染课程安排列表,false,false,false,false
siev1_12d26892ff493707,社区义卖所得将用于公共阅读角，现场也接受正常购买；想拿专享价就进私域群预付。,ad,closing_fragment,end,delete_promotion_clause,想拿专享价就进私域群预付,社区义卖所得将用于公共阅读角，现场也接受正常购买。,ad_closing_private_presale,私域预付招揽附着于义卖信息,true,false,false,false
siev1_c10fb64a3c62b34f,社区演出报名页顶部弹出“成人裸聊体验 PORN-DEMO-INVALID”，节目时间和无障碍入场说明仍在下方。,porn,opening_fragment,opening,remove_solicitation,顶部弹出“成人裸聊体验 PORN-DEMO-INVALID”，,社区演出报名页的节目时间和无障碍入场说明仍在下方。,porn_opening_performance_popup,色情弹窗来自同一演出报名页的广告位污染,true,false,false,false
siev1_cc4cf7b2942d78d1,【付费裸聊体验招募】周末市集摊位图、无障碍通道和公交路线如下。,porn,title_pollution,opening,remove_polluted_title,【付费裸聊体验招募】,周末市集摊位图、无障碍通道和公交路线如下。,porn_bracket_title_market_map,裸聊招募标题污染市集信息,false,false,false,false
siev1_e85a0e6dd314a1f4,旅行页面先列出沿海步道，随后宣传付费观看露骨视频，再提供公共交通时刻。,porn,embedded_clause,middle,delete_explicit_promotion,随后宣传付费观看露骨视频，,旅行页面先列出沿海步道，再提供公共交通时刻。,porn_mid_travel_promotion_transit,色情推广插入旅行页面内容,false,false,false,false
siev1_f37bec92cd290c56,健身应用的课程卡片把“无码私密照合集”设为跳转按钮，其他训练计划仍可正常使用。,porn,ui_pollution,embedded,replace_with_neutral_placeholder,“无码私密照合集”,健身应用的课程卡片使用“查看课程详情”按钮，其他训练计划仍可正常使用。,porn_ui_button_fitness_card,色情按钮污染健身应用界面,false,false,false,false
siev1_69eb529ad66389b2,民宿页面字段：入住=15:00；退房=11:00；弹窗=夜间裸聊房招募；早餐=一层餐厅。,porn,field_pollution,middle,remove_polluted_field,弹窗=夜间裸聊房招募；,民宿页面字段：入住=15:00；退房=11:00；早餐=一层餐厅。,porn_field_popup_guesthouse,裸聊招募弹窗污染民宿页面字段,false,false,false,false
siev1_d686fa88c706a6da,播客信息｜主题：成年人的沟通｜中场广告：付费解锁露骨自拍视频｜时长：35分钟,porn,list_pollution,middle,delete_explicit_promotion,中场广告：付费解锁露骨自拍视频｜,播客信息｜主题：成年人的沟通｜时长：35分钟,porn_pipe_podcast_midroll,色情付费广告污染播客信息,false,false,false,false
siev1_a38c414065dc59f9,听众问海岛路线怎么走，主播回答公交换乘后又说：“进入示例房间 PORN-VOID 参加裸聊体验。”,porn,dialogue,end,remove_solicitation,又说：“进入示例房间 PORN-VOID 参加裸聊体验。”,听众问海岛路线怎么走，主播回答了公交换乘方式。,porn_dialogue_island_room_invite,裸聊招揽发生在路线问答场景中,false,false,false,false
siev1_668a6dc6ce039771,顾客询问外套尺码，客服答复库存后追加“付费解锁露骨自拍包”，并继续说明退换期限。,porn,dialogue,embedded,delete_explicit_promotion,追加“付费解锁露骨自拍包”，,顾客询问外套尺码，客服答复库存并说明退换期限。,porn_dialogue_clothing_upsell,色情付费推销污染正常客服对话,false,false,false,false
siev1_63d4429d3c166899,摄影社区的作品说明记录了海边日落参数。发布者签名：示例房间 PORN-SIGN-INVALID 提供付费裸聊。,porn,signature_pollution,end,remove_polluted_signature,发布者签名：示例房间 PORN-SIGN-INVALID 提供付费裸聊。,摄影社区的作品说明记录了海边日落参数。,porn_signature_creator_profile,色情推广签名来自同一摄影社区发布者资料,true,false,false,false
siev1_6fd06205c011c1ae,摄影作品页展示海边日落，却用“色情直播体验”按钮替代正常的下一页链接。,porn,ui_pollution,embedded,replace_with_neutral_placeholder,“色情直播体验”,摄影作品页展示海边日落，并使用“下一页”按钮继续浏览。,porn_ui_photo_navigation,色情直播按钮污染摄影作品导航,false,false,false,false
siev1_17dcbe454b36a352,再打断我就推你一下；小组讨论仍按发言顺序进行。,violence,opening_fragment,opening,rewrite_nonviolent,再打断我就推你一下,如有不同意见请依次发言；小组讨论仍按发言顺序进行。,violence_opening_push_discussion,轻度威胁发生于小组发言冲突,true,false,false,false
siev1_338a321523e979f2,【谁反对就推谁】社团预算讨论纪要：场地费与材料费下周再核对。,violence,title_pollution,opening,remove_polluted_title,【谁反对就推谁】,社团预算讨论纪要：场地费与材料费下周再核对。,violence_bracket_title_budget_minutes,威胁性标题污染预算纪要,false,false,false,false
siev1_93ca4aa69f16baae,会议改到三点，你再迟到我就扇你一下，然后我们继续确认分工。,violence,same_sentence_embedded,middle,rewrite_nonviolent,你再迟到我就扇你一下,会议改到三点，请按时参加，然后我们继续确认分工。,violence_mid_meeting_lateness,迟到威胁与会议时间自然相关,false,false,false,false
siev1_5f05d8633efe37a8,组员：演示顺序需要调整吗？负责人：可以，但你再擅自改我的页面我就推你。组员：那我们按版本记录确认后再改。,violence,dialogue,middle,rewrite_nonviolent,但你再擅自改我的页面我就推你,组员：演示顺序需要调整吗？负责人：可以，但修改前请先和我确认。组员：那我们按版本记录确认后再改。,violence_dialogue_team_page_conflict,轻度推人威胁与团队协作中的页面修改冲突自然相关,false,false,false,false
siev1_154f25a213d9f04d,值班记录：区域=A区；秩序备注=再插队就把他推开；交接=18:00。,violence,field_pollution,middle,remove_threat_field,秩序备注=再插队就把他推开；,值班记录：区域=A区；交接=18:00。,violence_field_queue_record,推搡威胁污染值班秩序字段,false,false,false,false
siev1_8e6e483d870ee8ed,训练安排｜热身十分钟｜传球练习｜队长签名：再失误就踹你｜拉伸放松,violence,list_pollution,embedded,remove_threat_field,队长签名：再失误就踹你｜,训练安排｜热身十分钟｜传球练习｜拉伸放松,violence_pipe_training_signature,踢人威胁污染球队训练安排,false,false,false,false
siev1_13c671262c42a47f,甲：音量能调低吗？乙：可以，但你再敲门我就推你。甲：那我们十点后保持安静。,violence,dialogue,middle,rewrite_nonviolent,但你再敲门我就推你,甲：音量能调低吗？乙：可以，请直接沟通。甲：那我们十点后保持安静。,violence_dialogue_neighbor_noise,推人威胁发生在邻里噪声协商中,false,false,false,false
siev1_6209fa952e7e823c,同事：方案还要修改吗？负责人：可以讨论，谁再嘲笑我我就打谁。,violence,dialogue,end,rewrite_nonviolent,谁再嘲笑我我就打谁,同事：方案还要修改吗？负责人：可以讨论，请保持尊重。,violence_dialogue_workplace_mockery,打人威胁发生在工作讨论冲突中,false,false,false,false
siev1_01bc6dcc7ec04af6,停车区本周重新划线，临时车位从西门进入。留言：再占我的位置就踢你。,violence,signature_pollution,end,remove_polluted_signature,留言：再占我的位置就踢你。,停车区本周重新划线，临时车位从西门进入。,violence_signature_parking_notice,踢人威胁污染停车通知留言,true,false,false,false
siev1_66f1657ade4c6fff,比赛改在室内，输球我就给你一巴掌，训练时间仍是周六上午。,violence,same_sentence_embedded,middle,rewrite_nonviolent,输球我就给你一巴掌,比赛改在室内，请认真配合，训练时间仍是周六上午。,violence_mid_match_schedule,轻度威胁与球队比赛结果自然相关,false,false,false,false
siev1_101aca50bab1b66e,测试用户甲（虚构）的心理治疗记录号 DEMO-MH-000 出现在预约单顶部；预约时间仍为周二下午。,sensitive,opening_fragment,opening,redact_identifier,测试用户甲（虚构）的心理治疗记录号 DEMO-MH-000 出现在预约单顶部；,预约时间仍为周二下午。,sensitive_opening_record_appointment,虚构心理治疗编号污染预约单,false,false,false,false
siev1_f708d39f1bda5af4,心理咨询预约确认单标题：测试用户A（虚构），焦虑症治疗中；正文仅列出周三预约时段和取消规则。,sensitive,title_pollution,opening,remove_polluted_title,标题：测试用户A（虚构），焦虑症治疗中；,心理咨询预约确认单正文仅列出周三预约时段和取消规则。,sensitive_title_appointment_health,健康隐私标题来自同一心理咨询预约确认单,false,false,false,false
siev1_cc6a62c98ce3a836,住宿照护申请确认周五入住，公开摘要却写明“测试成员丙（虚构）正在接受抑郁治疗，夜间药物由同行照护员提醒”，房型仍为安静单间。,sensitive,same_sentence_embedded,middle,redact_health_support,公开摘要却写明“测试成员丙（虚构）正在接受抑郁治疗，夜间药物由同行照护员提醒”,住宿照护申请确认周五入住，健康支持详情已转入保密照护记录，房型仍为安静单间。,sensitive_field_care_lodging_health,治疗与用药信息源自同一住宿照护流程，但不应出现在公开摘要,false,false,false,false
siev1_2ecbf85a6d71a102,住宿申请：房型=安静单间；公开备注=同性伴侣同住、正在接受焦虑治疗；入住=周五。,sensitive,field_pollution,middle,remove_health_note,公开备注=同性伴侣同住、正在接受焦虑治疗；,住宿申请：房型=安静单间；入住=周五。,sensitive_field_lodging_note,关系与健康隐私污染住宿申请公开备注,false,false,false,false
siev1_34371cdff6c1542b,快递改派单：原因=包装破损；收件邮箱=demo-user@example.invalid；新时段=周六上午。,sensitive,field_pollution,middle,redact_identifier,收件邮箱=demo-user@example.invalid；,快递改派单：原因=包装破损；收件邮箱=[已遮盖]；新时段=周六上午。,sensitive_field_delivery_email,虚构联系字段与快递改派单自然相关,false,false,false,false
siev1_fb7cc25ede31d6ca,社区上门检修名单｜楼栋=示例楼｜独居住户门牌=DEMO-ROOM-000｜时段=14:00,sensitive,list_pollution,embedded,generalize_private_field,独居住户门牌=DEMO-ROOM-000｜,社区上门检修名单｜楼栋=示例楼｜住户门牌=[已遮盖]｜时段=14:00,sensitive_pipe_maintenance_room,虚构门牌与上门检修名单自然相关,false,false,false,false
siev1_10ca150ee52da8f9,校医：校内运动日保障表准备好了吗？班主任：公开栏误写了“测试学生乙（虚构）正在接受抑郁治疗，午间用药由校医保管”。校医：请转入保密健康档案，集合仍在医务室旁。,sensitive,dialogue,embedded,redact_health_support,公开栏误写了“测试学生乙（虚构）正在接受抑郁治疗，午间用药由校医保管”,校医：校内运动日保障表准备好了吗？班主任：健康保障详情已转入保密健康档案。校医：集合仍在医务室旁。,sensitive_field_school_health_safeguard,治疗与用药信息直接服务校内活动保障，但公开栏造成不当泄露,false,false,false,false
siev1_0d2699ebf2c47821,值班员：可以安排上门支持。求助者：我的演示门牌是 DEMO-STREET-000，请不要在群里公开。,sensitive,dialogue,end,redact_identifier,我的演示门牌是 DEMO-STREET-000，,值班员：可以安排上门支持。求助者：请通过私密渠道确认位置，不要在群里公开。,sensitive_dialogue_support_location,虚构位置字段与上门支持场景自然相关,false,false,false,false
siev1_1c2505704d6990b4,健康互助登记表：支持主题=长期用药提醒；公开备注误写=测试成员甲（虚构），HIV治疗随访中；服务安排=每周一次私密回访。,sensitive,field_pollution,middle,redact_health_support,公开备注误写=测试成员甲（虚构），HIV治疗随访中；,健康互助登记表：支持主题=长期用药提醒；健康信息=[转入保密登记]；服务安排=每周一次私密回访。,sensitive_field_health_support_registration,治疗随访信息与健康支持登记直接相关，但公开备注造成不当泄露,false,false,false,false
siev1_b1f71436d1b4ccd8,康复预约确认单把病历编号 DEMO-PSY-317 和下次咨询时间写在同一公开摘要中。,sensitive,same_sentence_embedded,embedded,redact_identifier,病历编号 DEMO-PSY-317 和,康复预约确认单只在公开摘要中保留下次咨询时间。,sensitive_mid_appointment_summary,虚构病历编号与康复预约确认单自然相关,false,false,false,false
